page,title,description,keywords,og_title,og_description,og_image,canonical_url
home,"Yahska Polymers - Construction Chemicals & Concrete Admixtures Manufacturer","Leading manufacturer of construction chemicals, concrete admixtures, and specialized chemical solutions for infrastructure projects in India","construction chemicals, concrete admixtures, infrastructure chemicals, building chemicals, yahska polymers","Yahska Polymers - Premium Construction Chemicals","Discover premium construction chemicals and concrete admixtures for your infrastructure projects",/images/og/home-banner.jpg,https://yahskapolymers.com/
about,"About Yahska Polymers - 8+ Years of Excellence in Construction Chemicals","Learn about Yahska Polymers' journey, mission, and commitment to delivering superior construction chemical solutions since 2015","about yahska polymers, construction chemicals company, chemical manufacturer gujarat","About Yahska Polymers","8+ years of excellence in manufacturing construction chemicals and concrete admixtures",/images/og/about-banner.jpg,https://yahskapolymers.com/about
products,"Construction Chemicals & Admixtures - Yahska Polymers Product Range","Explore our comprehensive range of construction chemicals including accelerators, admixtures, curing compounds, floor hardeners and more","construction chemicals products, concrete admixtures, accelerators, curing compounds, floor hardeners","Construction Chemicals Products","Premium construction chemicals for all your infrastructure needs",/images/og/products-banner.jpg,https://yahskapolymers.com/products
projects,"Infrastructure Projects - Yahska Polymers Portfolio","Discover our involvement in major infrastructure projects including bullet train, metro rail, highways and commercial construction","infrastructure projects, bullet train chemicals, metro construction, highway projects","Infrastructure Projects Portfolio","Trusted chemical solutions for India's major infrastructure projects",/images/og/projects-banner.jpg,https://yahskapolymers.com/projects
contact,"Contact Yahska Polymers - Get in Touch for Construction Chemical Solutions","Contact Yahska Polymers for premium construction chemicals and technical support. Located in Vadodara, Gujarat","contact yahska polymers, construction chemicals vadodara, chemical supplier gujarat","Contact Yahska Polymers","Get in touch for premium construction chemical solutions and technical support",/images/og/contact-banner.jpg,https://yahskapolymers.com/contact